Bluetooth monitor ver 5.53
= Note: Linux version 5.4.0-70-generic (x86_64)                        0.937699
= Note: Bluetooth subsystem version 2.22                               0.937704
= New Index: 10:63:C8:38:98:B6 (Primary,USB,hci0)               [hci0] 0.937705
= Open Index: 10:63:C8:38:98:B6                                 [hci0] 0.937707
= Index Info: 10:63:C8:38:98:B6 (Qualcomm)                      [hci0] 0.937708
@ MGMT Open: bluetoothd (privileged) version 1.14             {0x0001} 0.937709
@ MGMT Open: btmon (privileged) version 1.14                  {0x0002} 0.937868
@ MGMT Command: Start Service Disco.. (0x003a) plen 4  {0x0001} [hci0] 3.441279
        Address type: 0x06
          LE Public
          LE Random
        RSSI: invalid (0x7f)
        UUIDs: 0
< HCI Command: LE Set Random Address (0x08|0x0005) plen 6    #1 [hci0] 3.441333
        Address: 38:E5:83:D8:CB:0A (Non-Resolvable)
> HCI Event: Command Complete (0x0e) plen 4                  #2 [hci0] 3.559539
      LE Set Random Address (0x08|0x0005) ncmd 1
        Status: Success (0x00)
< HCI Command: LE Set Scan Parameters (0x08|0x000b) plen 7   #3 [hci0] 3.559593
        Type: Active (0x01)
        Interval: 11.250 msec (0x0012)
        Window: 11.250 msec (0x0012)
        Own address type: Random (0x01)
        Filter policy: Accept all advertisement (0x00)
> HCI Event: Command Complete (0x0e) plen 4                  #4 [hci0] 3.560541
      LE Set Random Address (0x08|0x0005) ncmd 1
        Status: Success (0x00)
> HCI Event: Command Complete (0x0e) plen 4                  #5 [hci0] 3.561540
      LE Set Scan Parameters (0x08|0x000b) ncmd 1
        Status: Success (0x00)
< HCI Command: LE Set Scan Enable (0x08|0x000c) plen 2       #6 [hci0] 3.561644
        Scanning: Enabled (0x01)
        Filter duplicates: Enabled (0x01)
> HCI Event: Command Complete (0x0e) plen 4                  #7 [hci0] 3.562595
      LE Set Scan Enable (0x08|0x000c) ncmd 1
        Status: Success (0x00)
@ MGMT Event: Command Complete (0x0001) plen 4         {0x0001} [hci0] 3.562755
      Start Service Discovery (0x003a) plen 1
        Status: Success (0x00)
        Address type: 0x06
          LE Public
          LE Random
@ MGMT Event: Discovering (0x0013) plen 2              {0x0002} [hci0] 3.562785
        Address type: 0x06
          LE Public
          LE Random
        Discovery: Enabled (0x01)
@ MGMT Event: Discovering (0x0013) plen 2              {0x0001} [hci0] 3.562785
        Address type: 0x06
          LE Public
          LE Random
        Discovery: Enabled (0x01)
> HCI Event: LE Meta Event (0x3e) plen 29                    #8 [hci0] 3.770605
      LE Advertising Report (0x02)
        Num reports: 1
        Event type: Connectable undirected - ADV_IND (0x00)
        Address type: Random (0x01)
        Address: 57:37:1A:67:C7:1D (Resolvable)
        Data length: 17
        Flags: 0x1a
          LE General Discoverable Mode
          Simultaneous LE and BR/EDR (Controller)
          Simultaneous LE and BR/EDR (Host)
        TX power: 12 dBm
        Company: Apple, Inc. (76)
          Type: Unknown (16)
          Data: 131c37625c
        RSSI: -81 dBm (0xaf)
> HCI Event: LE Meta Event (0x3e) plen 12                    #9 [hci0] 3.771621
      LE Advertising Report (0x02)
        Num reports: 1
        Event type: Scan response - SCAN_RSP (0x04)
        Address type: Random (0x01)
        Address: 57:37:1A:67:C7:1D (Resolvable)
        Data length: 0
        RSSI: -80 dBm (0xb0)
@ MGMT Event: Device Found (0x0012) plen 31            {0x0002} [hci0] 3.771701
        LE Address: 57:37:1A:67:C7:1D (Resolvable)
        RSSI: -80 dBm (0xb0)
        Flags: 0x00000000
        Data length: 17
        Flags: 0x1a
          LE General Discoverable Mode
          Simultaneous LE and BR/EDR (Controller)
          Simultaneous LE and BR/EDR (Host)
        TX power: 12 dBm
        Company: Apple, Inc. (76)
          Type: Unknown (16)
          Data: 131c37625c
@ MGMT Event: Device Found (0x0012) plen 31            {0x0001} [hci0] 3.771701
        LE Address: 57:37:1A:67:C7:1D (Resolvable)
        RSSI: -80 dBm (0xb0)
        Flags: 0x00000000
        Data length: 17
        Flags: 0x1a
          LE General Discoverable Mode
          Simultaneous LE and BR/EDR (Controller)
          Simultaneous LE and BR/EDR (Host)
        TX power: 12 dBm
        Company: Apple, Inc. (76)
          Type: Unknown (16)
          Data: 131c37625c
> HCI Event: LE Meta Event (0x3e) plen 43                   #10 [hci0] 3.910555
      LE Advertising Report (0x02)
        Num reports: 1
        Event type: Connectable undirected - ADV_IND (0x00)
        Address type: Public (0x00)
        Address: 14:07:1D:08:01:2E (OUI 14-07-1D)
        Data length: 31
        Flags: 0x06
          LE General Discoverable Mode
          BR/EDR Not Supported
        Company: Anhui Huami Information Technology Co., Ltd. (343)
          Data: 02ffffffffffffffffffffffffffffffff0314071d08012e
        RSSI: -80 dBm (0xb0)
> HCI Event: LE Meta Event (0x3e) plen 33                   #11 [hci0] 3.913599
      LE Advertising Report (0x02)
        Num reports: 1
        Event type: Scan response - SCAN_RSP (0x04)
        Address type: Public (0x00)
        Address: 14:07:1D:08:01:2E (OUI 14-07-1D)
        Data length: 21
        Name (complete): Mi Smart Band 5
        16-bit Service UUIDs (partial): 1 entry
          Anhui Huami Information Technology Co. (0xfee0)
        RSSI: -81 dBm (0xaf)
@ MGMT Event: Device Found (0x0012) plen 66            {0x0002} [hci0] 3.913697
        LE Address: 14:07:1D:08:01:2E (OUI 14-07-1D)
        RSSI: -81 dBm (0xaf)
        Flags: 0x00000000
        Data length: 52
        Flags: 0x06
          LE General Discoverable Mode
          BR/EDR Not Supported
        Company: Anhui Huami Information Technology Co., Ltd. (343)
          Data: 02ffffffffffffffffffffffffffffffff0314071d08012e
        Name (complete): Mi Smart Band 5
        16-bit Service UUIDs (partial): 1 entry
          Anhui Huami Information Technology Co. (0xfee0)
@ MGMT Event: Device Found (0x0012) plen 66            {0x0001} [hci0] 3.913697
        LE Address: 14:07:1D:08:01:2E (OUI 14-07-1D)
        RSSI: -81 dBm (0xaf)
        Flags: 0x00000000
        Data length: 52
        Flags: 0x06
          LE General Discoverable Mode
          BR/EDR Not Supported
        Company: Anhui Huami Information Technology Co., Ltd. (343)
          Data: 02ffffffffffffffffffffffffffffffff0314071d08012e
        Name (complete): Mi Smart Band 5
        16-bit Service UUIDs (partial): 1 entry
          Anhui Huami Information Technology Co. (0xfee0)
> HCI Event: LE Meta Event (0x3e) plen 20                   #12 [hci0] 4.736602
      LE Advertising Report (0x02)
        Num reports: 1
        Event type: Connectable undirected - ADV_IND (0x00)
        Address type: Public (0x00)
        Address: 00:1B:66:C1:9A:35 (Sennheiser electronic GmbH & Co. KG)
        Data length: 8
        16-bit Service UUIDs (complete): 3 entries
          Battery Service (0x180f)
          Device Information (0x180a)
          Unknown (0xfdce)
        RSSI: -80 dBm (0xb0)
> HCI Event: LE Meta Event (0x3e) plen 22                   #13 [hci0] 4.738603
      LE Advertising Report (0x02)
        Num reports: 1
        Event type: Scan response - SCAN_RSP (0x04)
        Address type: Public (0x00)
        Address: 00:1B:66:C1:9A:35 (Sennheiser electronic GmbH & Co. KG)
        Data length: 10
        Name (complete): HD 350BT
        RSSI: -78 dBm (0xb2)
@ MGMT Event: Device Found (0x0012) plen 32            {0x0002} [hci0] 4.738682
        LE Address: 00:1B:66:C1:9A:35 (Sennheiser electronic GmbH & Co. KG)
        RSSI: -78 dBm (0xb2)
        Flags: 0x00000000
        Data length: 18
        16-bit Service UUIDs (complete): 3 entries
          Battery Service (0x180f)
          Device Information (0x180a)
          Unknown (0xfdce)
        Name (complete): HD 350BT
@ MGMT Event: Device Found (0x0012) plen 32            {0x0001} [hci0] 4.738682
        LE Address: 00:1B:66:C1:9A:35 (Sennheiser electronic GmbH & Co. KG)
        RSSI: -78 dBm (0xb2)
        Flags: 0x00000000
        Data length: 18
        16-bit Service UUIDs (complete): 3 entries
          Battery Service (0x180f)
          Device Information (0x180a)
          Unknown (0xfdce)
        Name (complete): HD 350BT
> HCI Event: LE Meta Event (0x3e) plen 43                   #14 [hci0] 5.693577
      LE Advertising Report (0x02)
        Num reports: 1
        Event type: Non connectable undirected - ADV_NONCONN_IND (0x03)
        Address type: Random (0x01)
        Address: D7:41:53:CF:4B:4D (Static)
        Data length: 31
        Company: Apple, Inc. (76)
          Type: Unknown (18)
          Data: 00a59e66f0c9cfbe740e4d41f79c3febb637a6da8ff6c10300
        RSSI: -68 dBm (0xbc)
@ MGMT Event: Device Found (0x0012) plen 45            {0x0002} [hci0] 5.693665
        LE Address: D7:41:53:CF:4B:4D (Static)
        RSSI: -68 dBm (0xbc)
        Flags: 0x00000004
          Not Connectable
        Data length: 31
        Company: Apple, Inc. (76)
          Type: Unknown (18)
          Data: 00a59e66f0c9cfbe740e4d41f79c3febb637a6da8ff6c10300
@ MGMT Event: Device Found (0x0012) plen 45            {0x0001} [hci0] 5.693665
        LE Address: D7:41:53:CF:4B:4D (Static)
        RSSI: -68 dBm (0xbc)
        Flags: 0x00000004
          Not Connectable
        Data length: 31
        Company: Apple, Inc. (76)
          Type: Unknown (18)
          Data: 00a59e66f0c9cfbe740e4d41f79c3febb637a6da8ff6c10300
> HCI Event: LE Meta Event (0x3e) plen 20                   #15 [hci0] 6.506601
      LE Advertising Report (0x02)
        Num reports: 1
        Event type: Connectable undirected - ADV_IND (0x00)
        Address type: Public (0x00)
        Address: 00:1B:66:C1:9A:35 (Sennheiser electronic GmbH & Co. KG)
        Data length: 8
        16-bit Service UUIDs (complete): 3 entries
          Battery Service (0x180f)
          Device Information (0x180a)
          Unknown (0xfdce)
        RSSI: -85 dBm (0xab)
> HCI Event: LE Meta Event (0x3e) plen 39                   #16 [hci0] 7.071625
      LE Advertising Report (0x02)
        Num reports: 1
        Event type: Connectable undirected - ADV_IND (0x00)
        Address type: Public (0x00)
        Address: 84:CC:A8:48:64:C2 (Espressif Inc.)
        Data length: 27
        Flags: 0x06
          LE General Discoverable Mode
          BR/EDR Not Supported
        Name (complete): esp32-two-way
        TX power: 3 dBm
        Slave Conn. Interval: 0x0012 - 0x0040
        RSSI: -25 dBm (0xe7)
@ MGMT Event: Device Found (0x0012) plen 22            {0x0002} [hci0] 7.071706
        LE Address: 00:1B:66:C1:9A:35 (Sennheiser electronic GmbH & Co. KG)
        RSSI: -85 dBm (0xab)
        Flags: 0x00000000
        Data length: 8
        16-bit Service UUIDs (complete): 3 entries
          Battery Service (0x180f)
          Device Information (0x180a)
          Unknown (0xfdce)
@ MGMT Event: Device Found (0x0012) plen 22            {0x0001} [hci0] 7.071706
        LE Address: 00:1B:66:C1:9A:35 (Sennheiser electronic GmbH & Co. KG)
        RSSI: -85 dBm (0xab)
        Flags: 0x00000000
        Data length: 8
        16-bit Service UUIDs (complete): 3 entries
          Battery Service (0x180f)
          Device Information (0x180a)
          Unknown (0xfdce)
> HCI Event: LE Meta Event (0x3e) plen 12                   #17 [hci0] 7.072526
      LE Advertising Report (0x02)
        Num reports: 1
        Event type: Scan response - SCAN_RSP (0x04)
        Address type: Public (0x00)
        Address: 84:CC:A8:48:64:C2 (Espressif Inc.)
        Data length: 0
        RSSI: -27 dBm (0xe5)
@ MGMT Event: Device Found (0x0012) plen 41            {0x0002} [hci0] 7.072597
        LE Address: 84:CC:A8:48:64:C2 (Espressif Inc.)
        RSSI: -27 dBm (0xe5)
        Flags: 0x00000000
        Data length: 27
        Flags: 0x06
          LE General Discoverable Mode
          BR/EDR Not Supported
        Name (complete): esp32-two-way
        TX power: 3 dBm
        Slave Conn. Interval: 0x0012 - 0x0040
@ MGMT Event: Device Found (0x0012) plen 41            {0x0001} [hci0] 7.072597
        LE Address: 84:CC:A8:48:64:C2 (Espressif Inc.)
        RSSI: -27 dBm (0xe5)
        Flags: 0x00000000
        Data length: 27
        Flags: 0x06
          LE General Discoverable Mode
          BR/EDR Not Supported
        Name (complete): esp32-two-way
        TX power: 3 dBm
        Slave Conn. Interval: 0x0012 - 0x0040
@ MGMT Command: Stop Discovery (0x0024) plen 1         {0x0001} [hci0] 7.197585
        Address type: 0x06
          LE Public
          LE Random
< HCI Command: LE Set Scan Enable (0x08|0x000c) plen 2      #18 [hci0] 7.197706
        Scanning: Disabled (0x00)
        Filter duplicates: Disabled (0x00)
> HCI Event: Command Complete (0x0e) plen 4                 #19 [hci0] 7.199572
      LE Set Scan Enable (0x08|0x000c) ncmd 1
        Status: Success (0x00)
@ MGMT Event: Command Complete (0x0001) plen 4         {0x0001} [hci0] 7.199675
      Stop Discovery (0x0024) plen 1
        Status: Success (0x00)
        Address type: 0x06
          LE Public
          LE Random
@ MGMT Event: Discovering (0x0013) plen 2              {0x0002} [hci0] 7.199703
        Address type: 0x06
          LE Public
          LE Random
        Discovery: Disabled (0x00)
@ MGMT Event: Discovering (0x0013) plen 2              {0x0001} [hci0] 7.199703
        Address type: 0x06
          LE Public
          LE Random
        Discovery: Disabled (0x00)
< HCI Command: LE Set Scan Parameters (0x08|0x000b) plen 7  #20 [hci0] 7.257226
        Type: Passive (0x00)
        Interval: 60.000 msec (0x0060)
        Window: 30.000 msec (0x0030)
        Own address type: Public (0x00)
        Filter policy: Ignore not in white list (0x01)
> HCI Event: Command Complete (0x0e) plen 4                 #21 [hci0] 7.259629
      LE Set Scan Parameters (0x08|0x000b) ncmd 1
        Status: Success (0x00)
< HCI Command: LE Set Scan Enable (0x08|0x000c) plen 2      #22 [hci0] 7.259684
        Scanning: Enabled (0x01)
        Filter duplicates: Enabled (0x01)
> HCI Event: Command Complete (0x0e) plen 4                 #23 [hci0] 7.260636
      LE Set Scan Enable (0x08|0x000c) ncmd 1
        Status: Success (0x00)
> HCI Event: LE Meta Event (0x3e) plen 39                   #24 [hci0] 7.571534
      LE Advertising Report (0x02)
        Num reports: 1
        Event type: Connectable undirected - ADV_IND (0x00)
        Address type: Public (0x00)
        Address: 84:CC:A8:48:64:C2 (Espressif Inc.)
        Data length: 27
        Flags: 0x06
          LE General Discoverable Mode
          BR/EDR Not Supported
        Name (complete): esp32-two-way
        TX power: 3 dBm
        Slave Conn. Interval: 0x0012 - 0x0040
        RSSI: -28 dBm (0xe4)
< HCI Command: LE Set Scan Enable (0x08|0x000c) plen 2      #25 [hci0] 7.571615
        Scanning: Disabled (0x00)
        Filter duplicates: Disabled (0x00)
> HCI Event: Command Complete (0x0e) plen 4                 #26 [hci0] 7.572547
      LE Set Scan Enable (0x08|0x000c) ncmd 1
        Status: Success (0x00)
< HCI Command: LE Create Connection (0x08|0x000d) plen 25   #27 [hci0] 7.572606
        Scan interval: 60.000 msec (0x0060)
        Scan window: 60.000 msec (0x0060)
        Filter policy: White list is not used (0x00)
        Peer address type: Public (0x00)
        Peer address: 84:CC:A8:48:64:C2 (Espressif Inc.)
        Own address type: Public (0x00)
        Min connection interval: 30.00 msec (0x0018)
        Max connection interval: 50.00 msec (0x0028)
        Connection latency: 0 (0x0000)
        Supervision timeout: 420 msec (0x002a)
        Min connection length: 0.000 msec (0x0000)
        Max connection length: 0.000 msec (0x0000)
> HCI Event: Command Status (0x0f) plen 4                   #28 [hci0] 7.573560
      LE Create Connection (0x08|0x000d) ncmd 1
        Status: Success (0x00)
> HCI Event: LE Meta Event (0x3e) plen 19                   #29 [hci0] 7.615568
      LE Connection Complete (0x01)
        Status: Success (0x00)
        Handle: 7
        Role: Master (0x00)
        Peer address type: Public (0x00)
        Peer address: 84:CC:A8:48:64:C2 (Espressif Inc.)
        Connection interval: 45.00 msec (0x0024)
        Connection latency: 0 (0x0000)
        Supervision timeout: 420 msec (0x002a)
        Master clock accuracy: 0x00
@ MGMT Event: Device Connected (0x000b) plen 40        {0x0002} [hci0] 7.615622
        LE Address: 84:CC:A8:48:64:C2 (Espressif Inc.)
        Flags: 0x00000000
        Data length: 27
        Flags: 0x06
          LE General Discoverable Mode
          BR/EDR Not Supported
        Name (complete): esp32-two-way
        TX power: 3 dBm
        Slave Conn. Interval: 0x0012 - 0x0040
@ MGMT Event: Device Connected (0x000b) plen 40        {0x0001} [hci0] 7.615622
        LE Address: 84:CC:A8:48:64:C2 (Espressif Inc.)
        Flags: 0x00000000
        Data length: 27
        Flags: 0x06
          LE General Discoverable Mode
          BR/EDR Not Supported
        Name (complete): esp32-two-way
        TX power: 3 dBm
        Slave Conn. Interval: 0x0012 - 0x0040
< HCI Command: LE Read Remote Used... (0x08|0x0016) plen 2  #30 [hci0] 7.615796
        Handle: 7
> HCI Event: Command Status (0x0f) plen 4                   #31 [hci0] 7.626496
      LE Read Remote Used Features (0x08|0x0016) ncmd 1
        Status: Success (0x00)
> HCI Event: LE Meta Event (0x3e) plen 12                   #32 [hci0] 7.918574
      LE Read Remote Used Features (0x04)
        Status: Success (0x00)
        Handle: 7
        Features: 0xff 0x00 0x00 0x00 0x00 0x00 0x00 0x00
          LE Encryption
          Connection Parameter Request Procedure
          Extended Reject Indication
          Slave-initiated Features Exchange
          LE Ping
          LE Data Packet Length Extension
          LL Privacy
          Extended Scanner Filter Policies
< ACL Data TX: Handle 7 flags 0x00 dlen 7                   #33 [hci0] 7.919193
      ATT: Exchange MTU Request (0x02) len 2
        Client RX MTU: 517
> HCI Event: Number of Completed Packets (0x13) plen 5      #34 [hci0] 7.962551
        Num handles: 1
        Handle: 7
        Count: 1
> ACL Data RX: Handle 7 flags 0x02 dlen 7                   #35 [hci0] 8.007504
      ATT: Exchange MTU Response (0x03) len 2
        Server RX MTU: 517
< ACL Data TX: Handle 7 flags 0x00 dlen 7                   #36 [hci0] 8.008075
      ATT: Read Request (0x0a) len 2
        Handle: 0x0016
> HCI Event: Number of Completed Packets (0x13) plen 5      #37 [hci0] 8.052582
        Num handles: 1
        Handle: 7
        Count: 1
> ACL Data RX: Handle 7 flags 0x02 dlen 18                  #38 [hci0] 8.097535
      ATT: Read Response (0x0b) len 13
        Value: 65737033322d74776f2d776179
< ACL Data TX: Handle 7 flags 0x00 dlen 7                   #39 [hci0] 8.097873
      ATT: Read Request (0x0a) len 2
        Handle: 0x0018
> HCI Event: Number of Completed Packets (0x13) plen 5      #40 [hci0] 8.143560
        Num handles: 1
        Handle: 7
        Count: 1
> ACL Data RX: Handle 7 flags 0x02 dlen 7                   #41 [hci0] 8.187558
      ATT: Read Response (0x0b) len 2
        Value: 0000
< ACL Data TX: Handle 7 flags 0x00 dlen 11                  #42 [hci0] 8.187884
      ATT: Read By Group Type Request (0x10) len 6
        Handle range: 0x0001-0xffff
        Attribute group type: Primary Service (0x2800)
> HCI Event: Number of Completed Packets (0x13) plen 5      #43 [hci0] 8.233501
        Num handles: 1
        Handle: 7
        Count: 1
> ACL Data RX: Handle 7 flags 0x02 dlen 18                  #44 [hci0] 8.277544
      ATT: Read By Group Type Response (0x11) len 13
        Attribute data length: 6
        Attribute group list: 2 entries
        Handle range: 0x0001-0x0005
        UUID: Generic Attribute Profile (0x1801)
        Handle range: 0x0014-0x001c
        UUID: Generic Access Profile (0x1800)
< ACL Data TX: Handle 7 flags 0x00 dlen 11                  #45 [hci0] 8.277845
      ATT: Read By Group Type Request (0x10) len 6
        Handle range: 0x001d-0xffff
        Attribute group type: Primary Service (0x2800)
> HCI Event: Number of Completed Packets (0x13) plen 5      #46 [hci0] 8.323564
        Num handles: 1
        Handle: 7
        Count: 1
> ACL Data RX: Handle 7 flags 0x02 dlen 26                  #47 [hci0] 8.368580
      ATT: Read By Group Type Response (0x11) len 21
        Attribute data length: 20
        Attribute group list: 1 entry
        Handle range: 0x0028-0xffff
        UUID: Vendor specific (4fafc201-1fb5-459e-8fcc-c5c9c331914b)
< ACL Data TX: Handle 7 flags 0x00 dlen 9                   #48 [hci0] 8.444800
      ATT: Write Request (0x12) len 4
        Handle: 0x0004
          Data: 0200
> HCI Event: Number of Completed Packets (0x13) plen 5      #49 [hci0] 8.458537
        Num handles: 1
        Handle: 7
        Count: 1
> ACL Data RX: Handle 7 flags 0x02 dlen 5                   #50 [hci0] 8.502549
      ATT: Write Response (0x13) len 0
< ACL Data TX: Handle 7 flags 0x00 dlen 9                   #51 [hci0] 8.502828
      ATT: Write Request (0x12) len 4
        Handle: 0x002f
          Data: 0100
> HCI Event: Number of Completed Packets (0x13) plen 5      #52 [hci0] 8.548535
        Num handles: 1
        Handle: 7
        Count: 1
> ACL Data RX: Handle 7 flags 0x02 dlen 5                   #53 [hci0] 8.592551
      ATT: Write Response (0x13) len 0
< ACL Data TX: Handle 7 flags 0x00 dlen 7                   #54 [hci0] 8.593027
      ATT: Read Request (0x0a) len 2
        Handle: 0x002a
> HCI Event: Number of Completed Packets (0x13) plen 5      #55 [hci0] 8.637484
        Num handles: 1
        Handle: 7
        Count: 1
> ACL Data RX: Handle 7 flags 0x02 dlen 6                   #56 [hci0] 8.682506
      ATT: Read Response (0x0b) len 1
        Value: 30
< ACL Data TX: Handle 7 flags 0x00 dlen 8                   #57 [hci0] 8.687749
      ATT: Write Request (0x12) len 3
        Handle: 0x002a
          Data: 31
> HCI Event: Number of Completed Packets (0x13) plen 5      #58 [hci0] 8.727561
        Num handles: 1
        Handle: 7
        Count: 1
> ACL Data RX: Handle 7 flags 0x02 dlen 5                   #59 [hci0] 8.772545
      ATT: Write Response (0x13) len 0
< ACL Data TX: Handle 7 flags 0x00 dlen 7                  #60 [hci0] 10.775313
      ATT: Read Request (0x0a) len 2
        Handle: 0x002a
> HCI Event: Number of Completed Packets (0x13) plen 5     #61 [hci0] 10.798658
        Num handles: 1
        Handle: 7
        Count: 1
> ACL Data RX: Handle 7 flags 0x02 dlen 6                  #62 [hci0] 10.842488
      ATT: Read Response (0x0b) len 1
        Value: 31
< ACL Data TX: Handle 7 flags 0x00 dlen 8                  #63 [hci0] 10.844284
      ATT: Write Request (0x12) len 3
        Handle: 0x002a
          Data: 30
> HCI Event: Number of Completed Packets (0x13) plen 5     #64 [hci0] 10.888481
        Num handles: 1
        Handle: 7
        Count: 1
> ACL Data RX: Handle 7 flags 0x02 dlen 5                  #65 [hci0] 10.932464
      ATT: Write Response (0x13) len 0
< ACL Data TX: Handle 7 flags 0x00 dlen 7                  #66 [hci0] 12.937548
      ATT: Read Request (0x0a) len 2
        Handle: 0x002a
> HCI Event: Number of Completed Packets (0x13) plen 5     #67 [hci0] 12.958472
        Num handles: 1
        Handle: 7
        Count: 1
> ACL Data RX: Handle 7 flags 0x02 dlen 6                  #68 [hci0] 13.002467
      ATT: Read Response (0x0b) len 1
        Value: 30
< ACL Data TX: Handle 7 flags 0x00 dlen 8                  #69 [hci0] 13.008860
      ATT: Write Request (0x12) len 3
        Handle: 0x002a
          Data: 31
> HCI Event: Number of Completed Packets (0x13) plen 5     #70 [hci0] 13.048460
        Num handles: 1
        Handle: 7
        Count: 1
> ACL Data RX: Handle 7 flags 0x02 dlen 5                  #71 [hci0] 13.092452
      ATT: Write Response (0x13) len 0
< ACL Data TX: Handle 7 flags 0x00 dlen 7                  #72 [hci0] 15.096395
      ATT: Read Request (0x0a) len 2
        Handle: 0x002a
> HCI Event: Number of Completed Packets (0x13) plen 5     #73 [hci0] 15.118421
        Num handles: 1
        Handle: 7
        Count: 1
> ACL Data RX: Handle 7 flags 0x02 dlen 6                  #74 [hci0] 15.162438
      ATT: Read Response (0x0b) len 1
        Value: 31
< ACL Data TX: Handle 7 flags 0x00 dlen 8                  #75 [hci0] 15.167564
      ATT: Write Request (0x12) len 3
        Handle: 0x002a
          Data: 30
> HCI Event: Number of Completed Packets (0x13) plen 5     #76 [hci0] 15.208451
        Num handles: 1
        Handle: 7
        Count: 1
> ACL Data RX: Handle 7 flags 0x02 dlen 5                  #77 [hci0] 15.252484
      ATT: Write Response (0x13) len 0
< ACL Data TX: Handle 7 flags 0x00 dlen 7                  #78 [hci0] 17.255756
      ATT: Read Request (0x0a) len 2
        Handle: 0x002a
> HCI Event: Number of Completed Packets (0x13) plen 5     #79 [hci0] 17.278502
        Num handles: 1
        Handle: 7
        Count: 1
> ACL Data RX: Handle 7 flags 0x02 dlen 6                  #80 [hci0] 17.322429
      ATT: Read Response (0x0b) len 1
        Value: 30
< ACL Data TX: Handle 7 flags 0x00 dlen 8                  #81 [hci0] 17.324777
      ATT: Write Request (0x12) len 3
        Handle: 0x002a
          Data: 31
> HCI Event: Number of Completed Packets (0x13) plen 5     #82 [hci0] 17.368464
        Num handles: 1
        Handle: 7
        Count: 1
> ACL Data RX: Handle 7 flags 0x02 dlen 5                  #83 [hci0] 17.412501
      ATT: Write Response (0x13) len 0
< ACL Data TX: Handle 7 flags 0x00 dlen 7                  #84 [hci0] 19.416438
      ATT: Read Request (0x0a) len 2
        Handle: 0x002a
> HCI Event: Number of Completed Packets (0x13) plen 5     #85 [hci0] 19.438373
        Num handles: 1
        Handle: 7
        Count: 1
> ACL Data RX: Handle 7 flags 0x02 dlen 6                  #86 [hci0] 19.483383
      ATT: Read Response (0x0b) len 1
        Value: 31
< ACL Data TX: Handle 7 flags 0x00 dlen 8                  #87 [hci0] 19.486312
      ATT: Write Request (0x12) len 3
        Handle: 0x002a
          Data: 30
> HCI Event: Number of Completed Packets (0x13) plen 5     #88 [hci0] 19.528425
        Num handles: 1
        Handle: 7
        Count: 1
> ACL Data RX: Handle 7 flags 0x02 dlen 5                  #89 [hci0] 19.573486
      ATT: Write Response (0x13) len 0
< ACL Data TX: Handle 7 flags 0x00 dlen 7                  #90 [hci0] 21.577755
      ATT: Read Request (0x0a) len 2
        Handle: 0x002a
> HCI Event: Number of Completed Packets (0x13) plen 5     #91 [hci0] 21.598364
        Num handles: 1
        Handle: 7
        Count: 1
> ACL Data RX: Handle 7 flags 0x02 dlen 6                  #92 [hci0] 21.643364
      ATT: Read Response (0x0b) len 1
        Value: 30
< ACL Data TX: Handle 7 flags 0x00 dlen 8                  #93 [hci0] 21.648666
      ATT: Write Request (0x12) len 3
        Handle: 0x002a
          Data: 31
> HCI Event: Number of Completed Packets (0x13) plen 5     #94 [hci0] 21.688343
        Num handles: 1
        Handle: 7
        Count: 1
> ACL Data RX: Handle 7 flags 0x02 dlen 5                  #95 [hci0] 21.733407
      ATT: Write Response (0x13) len 0
< ACL Data TX: Handle 7 flags 0x00 dlen 7                  #96 [hci0] 23.736121
      ATT: Read Request (0x0a) len 2
        Handle: 0x002a
> HCI Event: Number of Completed Packets (0x13) plen 5     #97 [hci0] 23.758374
        Num handles: 1
        Handle: 7
        Count: 1
> ACL Data RX: Handle 7 flags 0x02 dlen 6                  #98 [hci0] 23.803383
      ATT: Read Response (0x0b) len 1
        Value: 31
< ACL Data TX: Handle 7 flags 0x00 dlen 8                  #99 [hci0] 23.805024
      ATT: Write Request (0x12) len 3
        Handle: 0x002a
          Data: 30
> HCI Event: Number of Completed Packets (0x13) plen 5    #100 [hci0] 23.848382
        Num handles: 1
        Handle: 7
        Count: 1
> ACL Data RX: Handle 7 flags 0x02 dlen 5                 #101 [hci0] 23.893392
      ATT: Write Response (0x13) len 0
< ACL Data TX: Handle 7 flags 0x00 dlen 7                 #102 [hci0] 25.897794
      ATT: Read Request (0x0a) len 2
        Handle: 0x002a
> HCI Event: Number of Completed Packets (0x13) plen 5    #103 [hci0] 25.918390
        Num handles: 1
        Handle: 7
        Count: 1
> ACL Data RX: Handle 7 flags 0x02 dlen 6                 #104 [hci0] 25.963327
      ATT: Read Response (0x0b) len 1
        Value: 30
< ACL Data TX: Handle 7 flags 0x00 dlen 8                 #105 [hci0] 25.968376
      ATT: Write Request (0x12) len 3
        Handle: 0x002a
          Data: 31
> HCI Event: Number of Completed Packets (0x13) plen 5    #106 [hci0] 26.008330
        Num handles: 1
        Handle: 7
        Count: 1
> ACL Data RX: Handle 7 flags 0x02 dlen 5                 #107 [hci0] 26.053342
      ATT: Write Response (0x13) len 0
< ACL Data TX: Handle 7 flags 0x00 dlen 7                 #108 [hci0] 28.057783
      ATT: Read Request (0x0a) len 2
        Handle: 0x002a
> HCI Event: Number of Completed Packets (0x13) plen 5    #109 [hci0] 28.078315
        Num handles: 1
        Handle: 7
        Count: 1
> ACL Data RX: Handle 7 flags 0x02 dlen 6                 #110 [hci0] 28.123314
      ATT: Read Response (0x0b) len 1
        Value: 31
< ACL Data TX: Handle 7 flags 0x00 dlen 8                 #111 [hci0] 28.129386
      ATT: Write Request (0x12) len 3
        Handle: 0x002a
          Data: 30
> HCI Event: Number of Completed Packets (0x13) plen 5    #112 [hci0] 28.168335
        Num handles: 1
        Handle: 7
        Count: 1
> ACL Data RX: Handle 7 flags 0x02 dlen 5                 #113 [hci0] 28.213299
      ATT: Write Response (0x13) len 0
< ACL Data TX: Handle 7 flags 0x00 dlen 7                 #114 [hci0] 30.217824
      ATT: Read Request (0x0a) len 2
        Handle: 0x002a
> HCI Event: Number of Completed Packets (0x13) plen 5    #115 [hci0] 30.238332
        Num handles: 1
        Handle: 7
        Count: 1
> ACL Data RX: Handle 7 flags 0x02 dlen 6                 #116 [hci0] 30.283298
      ATT: Read Response (0x0b) len 1
        Value: 30
< ACL Data TX: Handle 7 flags 0x00 dlen 8                 #117 [hci0] 30.288328
      ATT: Write Request (0x12) len 3
        Handle: 0x002a
          Data: 31
> HCI Event: Number of Completed Packets (0x13) plen 5    #118 [hci0] 30.328293
        Num handles: 1
        Handle: 7
        Count: 1
> ACL Data RX: Handle 7 flags 0x02 dlen 5                 #119 [hci0] 30.373351
      ATT: Write Response (0x13) len 0
< ACL Data TX: Handle 7 flags 0x00 dlen 7                 #120 [hci0] 32.378484
      ATT: Read Request (0x0a) len 2
        Handle: 0x002a
> HCI Event: Number of Completed Packets (0x13) plen 5    #121 [hci0] 32.398311
        Num handles: 1
        Handle: 7
        Count: 1
> ACL Data RX: Handle 7 flags 0x02 dlen 6                 #122 [hci0] 32.443271
      ATT: Read Response (0x0b) len 1
        Value: 31
< ACL Data TX: Handle 7 flags 0x00 dlen 8                 #123 [hci0] 32.449759
      ATT: Write Request (0x12) len 3
        Handle: 0x002a
          Data: 30
> HCI Event: Number of Completed Packets (0x13) plen 5    #124 [hci0] 32.488283
        Num handles: 1
        Handle: 7
        Count: 1
> ACL Data RX: Handle 7 flags 0x02 dlen 5                 #125 [hci0] 32.533368
      ATT: Write Response (0x13) len 0
< ACL Data TX: Handle 7 flags 0x00 dlen 7                 #126 [hci0] 34.537222
      ATT: Read Request (0x0a) len 2
        Handle: 0x002a
> HCI Event: Number of Completed Packets (0x13) plen 5    #127 [hci0] 34.558225
        Num handles: 1
        Handle: 7
        Count: 1
> ACL Data RX: Handle 7 flags 0x02 dlen 6                 #128 [hci0] 34.603318
      ATT: Read Response (0x0b) len 1
        Value: 30
< ACL Data TX: Handle 7 flags 0x00 dlen 8                 #129 [hci0] 34.608690
      ATT: Write Request (0x12) len 3
        Handle: 0x002a
          Data: 31
> HCI Event: Number of Completed Packets (0x13) plen 5    #130 [hci0] 34.648249
        Num handles: 1
        Handle: 7
        Count: 1
> ACL Data RX: Handle 7 flags 0x02 dlen 5                 #131 [hci0] 34.693291
      ATT: Write Response (0x13) len 0
< ACL Data TX: Handle 7 flags 0x00 dlen 7                 #132 [hci0] 36.696313
      ATT: Read Request (0x0a) len 2
        Handle: 0x002a
> HCI Event: Number of Completed Packets (0x13) plen 5    #133 [hci0] 36.718251
        Num handles: 1
        Handle: 7
        Count: 1
> ACL Data RX: Handle 7 flags 0x02 dlen 6                 #134 [hci0] 36.763239
      ATT: Read Response (0x0b) len 1
        Value: 31
< ACL Data TX: Handle 7 flags 0x00 dlen 8                 #135 [hci0] 36.768294
      ATT: Write Request (0x12) len 3
        Handle: 0x002a
          Data: 30
> HCI Event: Number of Completed Packets (0x13) plen 5    #136 [hci0] 36.808237
        Num handles: 1
        Handle: 7
        Count: 1
> ACL Data RX: Handle 7 flags 0x02 dlen 5                 #137 [hci0] 36.853276
      ATT: Write Response (0x13) len 0
< ACL Data TX: Handle 7 flags 0x00 dlen 7                 #138 [hci0] 38.857631
      ATT: Read Request (0x0a) len 2
        Handle: 0x002a
> HCI Event: Number of Completed Packets (0x13) plen 5    #139 [hci0] 38.878230
        Num handles: 1
        Handle: 7
        Count: 1
> ACL Data RX: Handle 7 flags 0x02 dlen 6                 #140 [hci0] 38.923259
      ATT: Read Response (0x0b) len 1
        Value: 30
< ACL Data TX: Handle 7 flags 0x00 dlen 8                 #141 [hci0] 38.928480
      ATT: Write Request (0x12) len 3
        Handle: 0x002a
          Data: 31
> HCI Event: Number of Completed Packets (0x13) plen 5    #142 [hci0] 38.968229
        Num handles: 1
        Handle: 7
        Count: 1
> ACL Data RX: Handle 7 flags 0x02 dlen 5                 #143 [hci0] 39.013237
      ATT: Write Response (0x13) len 0
< ACL Data TX: Handle 7 flags 0x00 dlen 7                 #144 [hci0] 41.017430
      ATT: Read Request (0x0a) len 2
        Handle: 0x002a
> HCI Event: Number of Completed Packets (0x13) plen 5    #145 [hci0] 41.038228
        Num handles: 1
        Handle: 7
        Count: 1
> ACL Data RX: Handle 7 flags 0x02 dlen 6                 #146 [hci0] 41.083191
      ATT: Read Response (0x0b) len 1
        Value: 31
< ACL Data TX: Handle 7 flags 0x00 dlen 8                 #147 [hci0] 41.086509
      ATT: Write Request (0x12) len 3
        Handle: 0x002a
          Data: 30
> HCI Event: Number of Completed Packets (0x13) plen 5    #148 [hci0] 41.128189
        Num handles: 1
        Handle: 7
        Count: 1
> ACL Data RX: Handle 7 flags 0x02 dlen 5                 #149 [hci0] 41.173195
      ATT: Write Response (0x13) len 0
< ACL Data TX: Handle 7 flags 0x00 dlen 7                 #150 [hci0] 43.177787
      ATT: Read Request (0x0a) len 2
        Handle: 0x002a
> HCI Event: Number of Completed Packets (0x13) plen 5    #151 [hci0] 43.198157
        Num handles: 1
        Handle: 7
        Count: 1
> ACL Data RX: Handle 7 flags 0x02 dlen 6                 #152 [hci0] 43.243228
      ATT: Read Response (0x0b) len 1
        Value: 30
< ACL Data TX: Handle 7 flags 0x00 dlen 8                 #153 [hci0] 43.248450
      ATT: Write Request (0x12) len 3
        Handle: 0x002a
          Data: 31
> HCI Event: Number of Completed Packets (0x13) plen 5    #154 [hci0] 43.288199
        Num handles: 1
        Handle: 7
        Count: 1
> ACL Data RX: Handle 7 flags 0x02 dlen 5                 #155 [hci0] 43.333173
      ATT: Write Response (0x13) len 0
< ACL Data TX: Handle 7 flags 0x00 dlen 7                 #156 [hci0] 45.337060
      ATT: Read Request (0x0a) len 2
        Handle: 0x002a
> HCI Event: Number of Completed Packets (0x13) plen 5    #157 [hci0] 45.358199
        Num handles: 1
        Handle: 7
        Count: 1
> ACL Data RX: Handle 7 flags 0x02 dlen 6                 #158 [hci0] 45.403145
      ATT: Read Response (0x0b) len 1
        Value: 31
< ACL Data TX: Handle 7 flags 0x00 dlen 8                 #159 [hci0] 45.408807
      ATT: Write Request (0x12) len 3
        Handle: 0x002a
          Data: 30
> HCI Event: Number of Completed Packets (0x13) plen 5    #160 [hci0] 45.448150
        Num handles: 1
        Handle: 7
        Count: 1
> ACL Data RX: Handle 7 flags 0x02 dlen 5                 #161 [hci0] 45.493232
      ATT: Write Response (0x13) len 0
< ACL Data TX: Handle 7 flags 0x00 dlen 7                 #162 [hci0] 47.496090
      ATT: Read Request (0x0a) len 2
        Handle: 0x002a
> HCI Event: Number of Completed Packets (0x13) plen 5    #163 [hci0] 47.518109
        Num handles: 1
        Handle: 7
        Count: 1
> ACL Data RX: Handle 7 flags 0x02 dlen 6                 #164 [hci0] 47.563190
      ATT: Read Response (0x0b) len 1
        Value: 30
< ACL Data TX: Handle 7 flags 0x00 dlen 8                 #165 [hci0] 47.568263
      ATT: Write Request (0x12) len 3
        Handle: 0x002a
          Data: 31
> HCI Event: Number of Completed Packets (0x13) plen 5    #166 [hci0] 47.608106
        Num handles: 1
        Handle: 7
        Count: 1
> ACL Data RX: Handle 7 flags 0x02 dlen 5                 #167 [hci0] 47.653163
      ATT: Write Response (0x13) len 0
> HCI Event: Disconnect Complete (0x05) plen 4            #168 [hci0] 48.079157
        Status: Success (0x00)
        Handle: 7
        Reason: Connection Timeout (0x08)
@ MGMT Event: Device Disconnected (0x000c) plen 8     {0x0002} [hci0] 48.079218
        LE Address: 84:CC:A8:48:64:C2 (Espressif Inc.)
        Reason: Connection timeout (0x01)
@ MGMT Event: Device Disconnected (0x000c) plen 8     {0x0001} [hci0] 48.079218
        LE Address: 84:CC:A8:48:64:C2 (Espressif Inc.)
        Reason: Connection timeout (0x01)
