Bluetooth monitor ver 5.53
= Note: Linux version 5.4.0-70-generic (x86_64)                        0.129579
= Note: Bluetooth subsystem version 2.22                               0.129581
= New Index: 10:63:C8:38:98:B6 (Primary,USB,hci0)               [hci0] 0.129582
= Open Index: 10:63:C8:38:98:B6                                 [hci0] 0.129582
= Index Info: 10:63:C8:38:98:B6 (Qualcomm)                      [hci0] 0.129583
@ MGMT Open: bluetoothd (privileged) version 1.14             {0x0001} 0.129583
@ MGMT Open: btmon (privileged) version 1.14                  {0x0002} 0.129671
@ MGMT Command: Start Service Disco.. (0x003a) plen 4  {0x0001} [hci0] 9.635085
        Address type: 0x06
          LE Public
          LE Random
        RSSI: invalid (0x7f)
        UUIDs: 0
< HCI Command: LE Set Random Address (0x08|0x0005) plen 6    #1 [hci0] 9.635280
        Address: 16:B3:C6:E1:15:11 (Non-Resolvable)
> HCI Event: Command Complete (0x0e) plen 4                  #2 [hci0] 9.751552
      LE Set Random Address (0x08|0x0005) ncmd 1
        Status: Success (0x00)
< HCI Command: LE Set Scan Parameters (0x08|0x000b) plen 7   #3 [hci0] 9.751657
        Type: Active (0x01)
        Interval: 11.250 msec (0x0012)
        Window: 11.250 msec (0x0012)
        Own address type: Random (0x01)
        Filter policy: Accept all advertisement (0x00)
> HCI Event: Command Complete (0x0e) plen 4                  #4 [hci0] 9.752633
      LE Set Random Address (0x08|0x0005) ncmd 1
        Status: Success (0x00)
> HCI Event: Command Complete (0x0e) plen 4                  #5 [hci0] 9.753631
      LE Set Scan Parameters (0x08|0x000b) ncmd 1
        Status: Success (0x00)
< HCI Command: LE Set Scan Enable (0x08|0x000c) plen 2       #6 [hci0] 9.753747
        Scanning: Enabled (0x01)
        Filter duplicates: Enabled (0x01)
> HCI Event: Command Complete (0x0e) plen 4                  #7 [hci0] 9.754535
      LE Set Scan Enable (0x08|0x000c) ncmd 1
        Status: Success (0x00)
@ MGMT Event: Command Complete (0x0001) plen 4         {0x0001} [hci0] 9.754704
      Start Service Discovery (0x003a) plen 1
        Status: Success (0x00)
        Address type: 0x06
          LE Public
          LE Random
@ MGMT Event: Discovering (0x0013) plen 2              {0x0002} [hci0] 9.754727
        Address type: 0x06
          LE Public
          LE Random
        Discovery: Enabled (0x01)
@ MGMT Event: Discovering (0x0013) plen 2              {0x0001} [hci0] 9.754727
        Address type: 0x06
          LE Public
          LE Random
        Discovery: Enabled (0x01)
> HCI Event: LE Meta Event (0x3e) plen 39                    #8 [hci0] 9.771673
      LE Advertising Report (0x02)
        Num reports: 1
        Event type: Connectable undirected - ADV_IND (0x00)
        Address type: Public (0x00)
        Address: 84:CC:A8:48:64:C2 (Espressif Inc.)
        Data length: 27
        Flags: 0x06
          LE General Discoverable Mode
          BR/EDR Not Supported
        Name (complete): esp32-two-way
        TX power: 3 dBm
        Slave Conn. Interval: 0x0012 - 0x0040
        RSSI: -28 dBm (0xe4)
> HCI Event: LE Meta Event (0x3e) plen 12                    #9 [hci0] 9.772566
      LE Advertising Report (0x02)
        Num reports: 1
        Event type: Scan response - SCAN_RSP (0x04)
        Address type: Public (0x00)
        Address: 84:CC:A8:48:64:C2 (Espressif Inc.)
        Data length: 0
        RSSI: -28 dBm (0xe4)
@ MGMT Event: Device Found (0x0012) plen 41            {0x0002} [hci0] 9.772620
        LE Address: 84:CC:A8:48:64:C2 (Espressif Inc.)
        RSSI: -28 dBm (0xe4)
        Flags: 0x00000000
        Data length: 27
        Flags: 0x06
          LE General Discoverable Mode
          BR/EDR Not Supported
        Name (complete): esp32-two-way
        TX power: 3 dBm
        Slave Conn. Interval: 0x0012 - 0x0040
@ MGMT Event: Device Found (0x0012) plen 41            {0x0001} [hci0] 9.772620
        LE Address: 84:CC:A8:48:64:C2 (Espressif Inc.)
        RSSI: -28 dBm (0xe4)
        Flags: 0x00000000
        Data length: 27
        Flags: 0x06
          LE General Discoverable Mode
          BR/EDR Not Supported
        Name (complete): esp32-two-way
        TX power: 3 dBm
        Slave Conn. Interval: 0x0012 - 0x0040
> HCI Event: LE Meta Event (0x3e) plen 29                   #10 [hci0] 9.840607
      LE Advertising Report (0x02)
        Num reports: 1
        Event type: Connectable undirected - ADV_IND (0x00)
        Address type: Random (0x01)
        Address: 73:EF:6E:2E:42:6E (Resolvable)
        Data length: 17
        Flags: 0x1a
          LE General Discoverable Mode
          Simultaneous LE and BR/EDR (Controller)
          Simultaneous LE and BR/EDR (Host)
        TX power: 12 dBm
        Company: Apple, Inc. (76)
          Type: Unknown (16)
          Data: 131ccc31ac
        RSSI: -83 dBm (0xad)
> HCI Event: LE Meta Event (0x3e) plen 12                   #11 [hci0] 9.841614
      LE Advertising Report (0x02)
        Num reports: 1
        Event type: Scan response - SCAN_RSP (0x04)
        Address type: Random (0x01)
        Address: 73:EF:6E:2E:42:6E (Resolvable)
        Data length: 0
        RSSI: -83 dBm (0xad)
@ MGMT Event: Device Found (0x0012) plen 31            {0x0002} [hci0] 9.841688
        LE Address: 73:EF:6E:2E:42:6E (Resolvable)
        RSSI: -83 dBm (0xad)
        Flags: 0x00000000
        Data length: 17
        Flags: 0x1a
          LE General Discoverable Mode
          Simultaneous LE and BR/EDR (Controller)
          Simultaneous LE and BR/EDR (Host)
        TX power: 12 dBm
        Company: Apple, Inc. (76)
          Type: Unknown (16)
          Data: 131ccc31ac
@ MGMT Event: Device Found (0x0012) plen 31            {0x0001} [hci0] 9.841688
        LE Address: 73:EF:6E:2E:42:6E (Resolvable)
        RSSI: -83 dBm (0xad)
        Flags: 0x00000000
        Data length: 17
        Flags: 0x1a
          LE General Discoverable Mode
          Simultaneous LE and BR/EDR (Controller)
          Simultaneous LE and BR/EDR (Host)
        TX power: 12 dBm
        Company: Apple, Inc. (76)
          Type: Unknown (16)
          Data: 131ccc31ac
> HCI Event: LE Meta Event (0x3e) plen 39                   #12 [hci0] 9.905603
      LE Advertising Report (0x02)
        Num reports: 1
        Event type: Connectable undirected - ADV_IND (0x00)
        Address type: Public (0x00)
        Address: 84:CC:A8:48:64:C2 (Espressif Inc.)
        Data length: 27
        Flags: 0x06
          LE General Discoverable Mode
          BR/EDR Not Supported
        Name (complete): esp32-two-way
        TX power: 3 dBm
        Slave Conn. Interval: 0x0012 - 0x0040
        RSSI: -27 dBm (0xe5)
@ MGMT Command: Stop Discovery (0x0024) plen 1        {0x0001} [hci0] 10.095734
        Address type: 0x06
          LE Public
          LE Random
< HCI Command: LE Set Scan Enable (0x08|0x000c) plen 2     #13 [hci0] 10.095905
        Scanning: Disabled (0x00)
        Filter duplicates: Disabled (0x00)
> HCI Event: Command Complete (0x0e) plen 4                #14 [hci0] 10.097635
      LE Set Scan Enable (0x08|0x000c) ncmd 1
        Status: Success (0x00)
@ MGMT Event: Command Complete (0x0001) plen 4        {0x0001} [hci0] 10.097826
      Stop Discovery (0x0024) plen 1
        Status: Success (0x00)
        Address type: 0x06
          LE Public
          LE Random
@ MGMT Event: Discovering (0x0013) plen 2             {0x0002} [hci0] 10.097854
        Address type: 0x06
          LE Public
          LE Random
        Discovery: Disabled (0x00)
@ MGMT Event: Discovering (0x0013) plen 2             {0x0001} [hci0] 10.097854
        Address type: 0x06
          LE Public
          LE Random
        Discovery: Disabled (0x00)
< HCI Command: LE Set Scan Paramet.. (0x08|0x000b) plen 7  #15 [hci0] 10.116427
        Type: Passive (0x00)
        Interval: 60.000 msec (0x0060)
        Window: 30.000 msec (0x0030)
        Own address type: Public (0x00)
        Filter policy: Ignore not in white list (0x01)
> HCI Event: Command Complete (0x0e) plen 4                #16 [hci0] 10.118580
      LE Set Scan Parameters (0x08|0x000b) ncmd 1
        Status: Success (0x00)
< HCI Command: LE Set Scan Enable (0x08|0x000c) plen 2     #17 [hci0] 10.118612
        Scanning: Enabled (0x01)
        Filter duplicates: Enabled (0x01)
> HCI Event: Command Complete (0x0e) plen 4                #18 [hci0] 10.119608
      LE Set Scan Enable (0x08|0x000c) ncmd 1
        Status: Success (0x00)
> HCI Event: LE Meta Event (0x3e) plen 39                  #19 [hci0] 10.220633
      LE Advertising Report (0x02)
        Num reports: 1
        Event type: Connectable undirected - ADV_IND (0x00)
        Address type: Public (0x00)
        Address: 84:CC:A8:48:64:C2 (Espressif Inc.)
        Data length: 27
        Flags: 0x06
          LE General Discoverable Mode
          BR/EDR Not Supported
        Name (complete): esp32-two-way
        TX power: 3 dBm
        Slave Conn. Interval: 0x0012 - 0x0040
        RSSI: -27 dBm (0xe5)
< HCI Command: LE Set Scan Enable (0x08|0x000c) plen 2     #20 [hci0] 10.220766
        Scanning: Disabled (0x00)
        Filter duplicates: Disabled (0x00)
> HCI Event: Command Complete (0x0e) plen 4                #21 [hci0] 10.221551
      LE Set Scan Enable (0x08|0x000c) ncmd 1
        Status: Success (0x00)
< HCI Command: LE Create Connection (0x08|0x000d) plen 25  #22 [hci0] 10.221649
        Scan interval: 60.000 msec (0x0060)
        Scan window: 60.000 msec (0x0060)
        Filter policy: White list is not used (0x00)
        Peer address type: Public (0x00)
        Peer address: 84:CC:A8:48:64:C2 (Espressif Inc.)
        Own address type: Public (0x00)
        Min connection interval: 30.00 msec (0x0018)
        Max connection interval: 50.00 msec (0x0028)
        Connection latency: 0 (0x0000)
        Supervision timeout: 420 msec (0x002a)
        Min connection length: 0.000 msec (0x0000)
        Max connection length: 0.000 msec (0x0000)
> HCI Event: Command Status (0x0f) plen 4                  #23 [hci0] 10.222558
      LE Create Connection (0x08|0x000d) ncmd 1
        Status: Success (0x00)
> HCI Event: LE Meta Event (0x3e) plen 19                  #24 [hci0] 10.262664
      LE Connection Complete (0x01)
        Status: Success (0x00)
        Handle: 4
        Role: Master (0x00)
        Peer address type: Public (0x00)
        Peer address: 84:CC:A8:48:64:C2 (Espressif Inc.)
        Connection interval: 45.00 msec (0x0024)
        Connection latency: 0 (0x0000)
        Supervision timeout: 420 msec (0x002a)
        Master clock accuracy: 0x00
@ MGMT Event: Device Connected (0x000b) plen 40       {0x0002} [hci0] 10.262779
        LE Address: 84:CC:A8:48:64:C2 (Espressif Inc.)
        Flags: 0x00000000
        Data length: 27
        Flags: 0x06
          LE General Discoverable Mode
          BR/EDR Not Supported
        Name (complete): esp32-two-way
        TX power: 3 dBm
        Slave Conn. Interval: 0x0012 - 0x0040
@ MGMT Event: Device Connected (0x000b) plen 40       {0x0001} [hci0] 10.262779
        LE Address: 84:CC:A8:48:64:C2 (Espressif Inc.)
        Flags: 0x00000000
        Data length: 27
        Flags: 0x06
          LE General Discoverable Mode
          BR/EDR Not Supported
        Name (complete): esp32-two-way
        TX power: 3 dBm
        Slave Conn. Interval: 0x0012 - 0x0040
< HCI Command: LE Read Remote Used.. (0x08|0x0016) plen 2  #25 [hci0] 10.262944
        Handle: 4
> HCI Event: Command Status (0x0f) plen 4                  #26 [hci0] 10.274531
      LE Read Remote Used Features (0x08|0x0016) ncmd 1
        Status: Success (0x00)
> HCI Event: LE Meta Event (0x3e) plen 12                  #27 [hci0] 10.566606
      LE Read Remote Used Features (0x04)
        Status: Success (0x00)
        Handle: 4
        Features: 0xff 0x00 0x00 0x00 0x00 0x00 0x00 0x00
          LE Encryption
          Connection Parameter Request Procedure
          Extended Reject Indication
          Slave-initiated Features Exchange
          LE Ping
          LE Data Packet Length Extension
          LL Privacy
          Extended Scanner Filter Policies
< ACL Data TX: Handle 4 flags 0x00 dlen 7                  #28 [hci0] 10.610227
      ATT: Exchange MTU Request (0x02) len 2
        Client RX MTU: 517
> HCI Event: Number of Completed Packets (0x13) plen 5     #29 [hci0] 10.656595
        Num handles: 1
        Handle: 4
        Count: 1
> ACL Data RX: Handle 4 flags 0x02 dlen 7                  #30 [hci0] 10.701604
      ATT: Exchange MTU Response (0x03) len 2
        Server RX MTU: 517
< ACL Data TX: Handle 4 flags 0x00 dlen 7                  #31 [hci0] 10.702235
      ATT: Read Request (0x0a) len 2
        Handle: 0x0016
> HCI Event: Number of Completed Packets (0x13) plen 5     #32 [hci0] 10.746576
        Num handles: 1
        Handle: 4
        Count: 1
> ACL Data RX: Handle 4 flags 0x02 dlen 18                 #33 [hci0] 10.791609
      ATT: Read Response (0x0b) len 13
        Value: 65737033322d74776f2d776179
< ACL Data TX: Handle 4 flags 0x00 dlen 7                  #34 [hci0] 10.791924
      ATT: Read Request (0x0a) len 2
        Handle: 0x0018
> HCI Event: Number of Completed Packets (0x13) plen 5     #35 [hci0] 10.836606
        Num handles: 1
        Handle: 4
        Count: 1
> ACL Data RX: Handle 4 flags 0x02 dlen 7                  #36 [hci0] 10.881616
      ATT: Read Response (0x0b) len 2
        Value: 0000
< ACL Data TX: Handle 4 flags 0x00 dlen 11                 #37 [hci0] 10.882036
      ATT: Read By Group Type Request (0x10) len 6
        Handle range: 0x0001-0xffff
        Attribute group type: Primary Service (0x2800)
> HCI Event: Number of Completed Packets (0x13) plen 5     #38 [hci0] 10.926541
        Num handles: 1
        Handle: 4
        Count: 1
> ACL Data RX: Handle 4 flags 0x02 dlen 18                 #39 [hci0] 10.971619
      ATT: Read By Group Type Response (0x11) len 13
        Attribute data length: 6
        Attribute group list: 2 entries
        Handle range: 0x0001-0x0005
        UUID: Generic Attribute Profile (0x1801)
        Handle range: 0x0014-0x001c
        UUID: Generic Access Profile (0x1800)
< ACL Data TX: Handle 4 flags 0x00 dlen 11                 #40 [hci0] 10.971933
      ATT: Read By Group Type Request (0x10) len 6
        Handle range: 0x001d-0xffff
        Attribute group type: Primary Service (0x2800)
> HCI Event: Number of Completed Packets (0x13) plen 5     #41 [hci0] 11.016593
        Num handles: 1
        Handle: 4
        Count: 1
> ACL Data RX: Handle 4 flags 0x02 dlen 26                 #42 [hci0] 11.061620
      ATT: Read By Group Type Response (0x11) len 21
        Attribute data length: 20
        Attribute group list: 1 entry
        Handle range: 0x0028-0xffff
        UUID: Vendor specific (4fafc201-1fb5-459e-8fcc-c5c9c331914b)
< ACL Data TX: Handle 4 flags 0x00 dlen 9                  #43 [hci0] 11.862817
      ATT: Write Request (0x12) len 4
        Handle: 0x0004
          Data: 0200
> HCI Event: Number of Completed Packets (0x13) plen 5     #44 [hci0] 11.871601
        Num handles: 1
        Handle: 4
        Count: 1
> ACL Data RX: Handle 4 flags 0x02 dlen 5                  #45 [hci0] 11.916554
      ATT: Write Response (0x13) len 0
< ACL Data TX: Handle 4 flags 0x00 dlen 9                  #46 [hci0] 11.916841
      ATT: Write Request (0x12) len 4
        Handle: 0x002f
          Data: 0100
> HCI Event: Number of Completed Packets (0x13) plen 5     #47 [hci0] 11.961515
        Num handles: 1
        Handle: 4
        Count: 1
> ACL Data RX: Handle 4 flags 0x02 dlen 9                  #48 [hci0] 12.006544
      ATT: Error Response (0x01) len 4
        Write Request (0x12)
        Handle: 0x002f
        Error: Invalid Handle (0x01)
< ACL Data TX: Handle 4 flags 0x00 dlen 7                  #49 [hci0] 12.007819
      ATT: Read Request (0x0a) len 2
        Handle: 0x002a
> HCI Event: Number of Completed Packets (0x13) plen 5     #50 [hci0] 12.051610
        Num handles: 1
        Handle: 4
        Count: 1
> ACL Data RX: Handle 4 flags 0x02 dlen 6                  #51 [hci0] 12.096666
      ATT: Read Response (0x0b) len 1
        Value: 30
< ACL Data TX: Handle 4 flags 0x00 dlen 8                  #52 [hci0] 12.102333
      ATT: Write Request (0x12) len 3
        Handle: 0x002a
          Data: 31
> HCI Event: Number of Completed Packets (0x13) plen 5     #53 [hci0] 12.141706
        Num handles: 1
        Handle: 4
        Count: 1
> ACL Data RX: Handle 4 flags 0x02 dlen 5                  #54 [hci0] 12.186610
      ATT: Write Response (0x13) len 0
< ACL Data TX: Handle 4 flags 0x00 dlen 7                  #55 [hci0] 13.191778
      ATT: Read Request (0x0a) len 2
        Handle: 0x002a
> HCI Event: Number of Completed Packets (0x13) plen 5     #56 [hci0] 13.221664
        Num handles: 1
        Handle: 4
        Count: 1
> ACL Data RX: Handle 4 flags 0x02 dlen 6                  #57 [hci0] 13.266650
      ATT: Read Response (0x0b) len 1
        Value: 31
< ACL Data TX: Handle 4 flags 0x00 dlen 8                  #58 [hci0] 13.271480
      ATT: Write Request (0x12) len 3
        Handle: 0x002a
          Data: 30
> HCI Event: Number of Completed Packets (0x13) plen 5     #59 [hci0] 13.311536
        Num handles: 1
        Handle: 4
        Count: 1
> ACL Data RX: Handle 4 flags 0x02 dlen 5                  #60 [hci0] 13.356692
      ATT: Write Response (0x13) len 0
< ACL Data TX: Handle 4 flags 0x00 dlen 7                  #61 [hci0] 14.361404
      ATT: Read Request (0x0a) len 2
        Handle: 0x002a
> HCI Event: Number of Completed Packets (0x13) plen 5     #62 [hci0] 14.391535
        Num handles: 1
        Handle: 4
        Count: 1
> ACL Data RX: Handle 4 flags 0x02 dlen 6                  #63 [hci0] 14.436599
      ATT: Read Response (0x0b) len 1
        Value: 30
@ MGMT Command: Disconnect (0x0014) plen 7            {0x0001} [hci0] 14.441334
        LE Address: 84:CC:A8:48:64:C2 (Espressif Inc.)
< HCI Command: Disconnect (0x01|0x0006) plen 3             #64 [hci0] 14.441394
        Handle: 4
        Reason: Remote User Terminated Connection (0x13)
> HCI Event: Command Status (0x0f) plen 4                  #65 [hci0] 14.443529
      Disconnect (0x01|0x0006) ncmd 1
        Status: Success (0x00)
> HCI Event: Disconnect Complete (0x05) plen 4             #66 [hci0] 14.487588
        Status: Success (0x00)
        Handle: 4
        Reason: Connection Terminated By Local Host (0x16)
@ MGMT Event: Command Complete (0x0001) plen 10       {0x0001} [hci0] 14.487706
      Disconnect (0x0014) plen 7
        Status: Success (0x00)
        LE Address: 84:CC:A8:48:64:C2 (Espressif Inc.)
@ MGMT Event: Device Disconnected (0x000c) plen 8     {0x0002} [hci0] 14.487721
        LE Address: 84:CC:A8:48:64:C2 (Espressif Inc.)
        Reason: Connection terminated by local host (0x02)
